{
  "$schema": "./schemas/requirements.schema.json",
  "$depends_on": [],
  "engagement_id": "eng-2026-003",
  "version": "2.2",
  "last_updated": "2026-03-19",
  "status": "complete",
  "client_context": {
    "legal_name": "PAI (Adobe Enterprise Interview)",
    "brand_name": "PAI Take-Home Exercise",
    "industry": "Consumer Packaged Goods (CPG) \u2014 Interview Scenario",
    "company_size": "enterprise",
    "ai_maturity": "advanced",
    "ai_history": "Scenario depicts a global CPG manufacturer adopting GenAI for packaging automation. Interview context: Adobe enterprise role leveraging AWS + GenAI."
  },
  "problem_statement": {
    "title": "Product Packaging Variant Generation at Scale via GenAI",
    "summary": "A global CPG manufacturer needs to generate hundreds of localized product packaging variants monthly across regional markets. Current manual design processes are slow, expensive, error-prone, and create bottlenecks in approval cycles. The PoC demonstrates an automated GenAI pipeline that accepts SKU briefs, generates region-specific packaging designs in multiple aspect ratios, and organizes outputs in S3.",
    "current_state": {
      "process_description": "Design teams manually create and localize packaging variants for hundreds of SKUs per month using decentralized design processes and multiple agencies. Regulatory review and brand approval involve multiple stakeholders per region, creating bottlenecks.",
      "tools_in_use": [
        "Manual design tools",
        "Decentralized agency workflows",
        "Siloed design file storage"
      ],
      "pain_points": [
        "Manual packaging design overload: creating/localizing variants for hundreds of SKUs is slow, expensive, and error-prone",
        "Inconsistent quality and compliance: off-brand or non-compliant packaging due to decentralized processes",
        "Slow approval cycles: bottlenecks with multiple stakeholders in each region",
        "Difficulty tracking regulatory compliance at scale: siloed files and manual compliance checking",
        "Resource drain: skilled design teams overloaded with repetitive layout/resizing instead of strategic creative work"
      ],
      "annual_cost": "Not quantified (interview scenario)",
      "volume": "Hundreds of localized variants per month across regional markets"
    },
    "desired_state": {
      "description": "Automated GenAI pipeline that generates packaging variants from SKU briefs, maintains brand consistency, produces multiple aspect ratios, and organizes outputs systematically in S3. Frees design teams for strategic creative work.",
      "target_improvements": [
        "Accelerate time-to-market for regional packaging variants",
        "Ensure brand consistency across all markets via automated generation",
        "Maximize local relevance through region-specific imagery and messaging",
        "Reduce manual rework and approval cycle time",
        "Track design effectiveness and compliance at scale"
      ]
    }
  },
  "ai_suitability_assessment": {
    "score": 9,
    "rationale": "GenAI image generation is the core technology for this use case. The task involves generating visual variants from structured inputs (SKU briefs), which is a direct application of generative AI. All 6 suitability criteria score YES: repeatable generation task, structured input data available, current human process is inconsistent, clear time/cost savings, error tolerances compatible with iterative generation, and human review gates prevent autonomous risk.",
    "favorable_factors": [
      "Image generation from structured prompts is a proven GenAI capability",
      "Repeatable task: same pipeline processes different SKU briefs",
      "Structured input (JSON SKU briefs) enables consistent prompt construction",
      "Multiple aspect ratio generation is a natural fit for image generation APIs",
      "Human review gates for brand compliance reduce autonomous decision risk",
      "Measurable ROI: variants per hour vs. manual design time"
    ],
    "risk_factors": [
      "GenAI image quality may not meet premium packaging standards without fine-tuning",
      "Brand consistency requires careful prompt engineering or reference image conditioning",
      "Regulatory text overlay (allergens, ingredients) needs precise placement \u2014 Pillow handles this reliably vs. relying on GenAI for text",
      "PoC scope limits validation of production-scale reliability"
    ],
    "recommendation": "strong_fit"
  },
  "pain_points": [
    "Manual packaging design overload: creating and localizing design variants for hundreds of SKUs per month is slow, expensive, and error-prone (Classification: Process inefficiency; Impact: days per variant; Pattern: GenAI automated generation)",
    "Inconsistent quality and compliance: risk of off-brand, non-compliant packaging due to decentralized design processes and multiple agencies (Classification: Data quality / Compliance risk; Impact: brand damage, regulatory delays; Pattern: Automated brand compliance checks)",
    "Slow approval cycles: bottlenecks in regulatory review and brand approval with multiple stakeholders per region (Classification: Process inefficiency; Impact: weeks of delay per cycle; Pattern: Automated pre-screening + approval tracking)",
    "Difficulty tracking regulatory compliance at scale: siloed design files and manual compliance checking (Classification: Compliance risk / Integration gap; Impact: non-compliant designs reaching production; Pattern: Centralized asset management + compliance logging)",
    "Resource drain: skilled design and brand teams overloaded with repetitive layout/resizing requests instead of strategic creative work (Classification: Process inefficiency / Knowledge loss; Impact: reduced creative output; Pattern: GenAI handles repetitive variants, humans focus on creative direction)"
  ],
  "success_criteria": [
    {
      "id": "SC-001",
      "metric": "Pipeline Functionality",
      "description": "PoC accepts SKU brief JSON and produces packaging images in 3 aspect ratios",
      "baseline": 0,
      "target": 1,
      "measurement": "Binary: pipeline runs end-to-end for at least 2 products",
      "timeframe": "Phase 2 (core pipeline)"
    },
    {
      "id": "SC-002",
      "metric": "Multi-Product Support",
      "description": "Pipeline processes at least 2 different products/flavors from a single SKU brief",
      "baseline": 0,
      "target": 2,
      "measurement": "Count of distinct products with generated packaging",
      "timeframe": "Phase 2 (core pipeline)"
    },
    {
      "id": "SC-003",
      "metric": "S3 Output Organization",
      "description": "Generated assets are saved to S3 organized by SKU, Region, and format",
      "baseline": 0,
      "target": 1,
      "measurement": "Binary: S3 structure matches SKU/Region/format hierarchy",
      "timeframe": "Phase 3 (output quality)"
    },
    {
      "id": "SC-004",
      "metric": "Documentation Completeness",
      "description": "README covers how to run, example I/O, key decisions, and assumptions",
      "baseline": 0,
      "target": 4,
      "measurement": "Count of required README sections present",
      "timeframe": "Phase 5 (docs and demo)"
    },
    {
      "id": "SC-005",
      "metric": "IaC Deployment",
      "description": "AWS resources deployed via CloudFormation (not Terraform)",
      "baseline": 0,
      "target": 1,
      "measurement": "Binary: CloudFormation stack deploys to CREATE_COMPLETE",
      "timeframe": "Phase 1 (foundation)"
    },
    {
      "id": "SC-006",
      "metric": "Image Quality Inspection",
      "description": "Each generated packaging image is visually inspectable and displays product name, at least one key attribute, and regulatory text in legible form.",
      "baseline": 0,
      "target": 1,
      "measurement": "Human visual inspection of generated images \u2014 pass if product name and attributes are readable",
      "timeframe": "End of Phase 2 (core pipeline complete)"
    }
  ],
  "stakeholders": [
    {
      "name": "Interview Panel",
      "role": "Senior Engineers + Hiring Manager",
      "type": "reviewer",
      "approval_authority": [
        "technical",
        "hiring"
      ],
      "communication_preference": "Live demo + code walkthrough (20-30 min)"
    },
    {
      "name": "Candidate (Developer)",
      "role": "Solutions Architect / Developer",
      "type": "contributor",
      "approval_authority": [],
      "communication_preference": "Self-directed, AI-assisted development"
    }
  ],
  "functional_requirements": [
    {
      "id": "FR-001",
      "title": "SKU Brief JSON Input",
      "description": "Accept a structured JSON SKU brief containing: product(s) with at least 2 different products/flavors, target region/market, target audience/demographics, and key product attributes (e.g., organic, vegan, seasonal).",
      "priority": "must_have",
      "complexity": "low",
      "acceptance_criteria": [
        "Accepts valid JSON SKU brief",
        "Supports at least 2 products/flavors per brief",
        "Parses region, audience, and attribute fields"
      ],
      "dependencies": []
    },
    {
      "id": "FR-002",
      "title": "S3 Asset Input and Reuse",
      "description": "Accept input brand assets stored in AWS S3 and reuse them when available for packaging generation.",
      "priority": "must_have",
      "complexity": "medium",
      "acceptance_criteria": [
        "Reads brand assets from a configured S3 bucket",
        "Detects when existing assets are available and reuses them",
        "Falls through to generation when assets are missing"
      ],
      "dependencies": [
        "FR-001"
      ]
    },
    {
      "id": "FR-003",
      "title": "GenAI Image Generation",